supplier,period,quality_score,delivery_score,cost_score,innovation_score,relationship_score,overall_score,performance_level,comments
Skyworks Aviation,2025-Q1,8.5,7.2,6.8,8.1,7.9,7.7,good,Consistent quality with reasonable cost control and good innovation
Altitude Aerospace,2025-Q1,9.1,8.5,7.6,8.9,8.4,8.5,excellent,Excellent overall performance with outstanding quality and innovation
Global Turbine Solutions,2025-Q1,7.8,9.2,8.5,6.5,8.7,8.1,good,Outstanding delivery reliability with good cost management
AeroComposite Materials,2025-Q1,6.2,5.8,7.9,6.5,6.1,6.5,average,Cost performance is strong but quality and delivery need improvement
Precision Aerospace Systems,2025-Q1,9.5,8.8,6.7,7.5,8.2,8.1,good,Superior quality with good delivery performance
AviationTech Solutions,2025-Q1,7.1,6.8,6.5,8.9,7.5,7.4,good,Innovation is their strongest area with adequate performance elsewhere
FlightSafety Training,2025-Q1,8.7,8.5,7.8,7.5,9.2,8.3,excellent,Outstanding relationship management and consistent quality
AeroDynamics International,2025-Q1,6.5,5.9,8.2,7.8,6.7,7.0,average,Strong cost performance but delivery reliability issues
Aviation Fuel Services,2025-Q1,8.0,9.5,5.5,5.8,7.9,7.3,good,Excellent delivery reliability but higher cost structure
TechAero Services,2025-Q1,5.8,6.2,7.0,8.5,6.5,6.8,average,Innovation is strong but quality needs significant improvement